{
  "$schema": "http://json-schema.org/draft-07/schema#",
  "$id": "https://github.com/trailofdad/morphkit-dictionary/schema.json",
  "title": "MorphkitDictionary",
  "description": "The Morphkit genetic dictionary — trait data consumed by the morphkit engine.",
  "type": "object",
  "required": ["version", "lastUpdated", "loci", "combos", "lethalCombos", "polygenicTags"],
  "additionalProperties": false,

  "properties": {
    "version": {
      "type": "string",
      "description": "SemVer string, e.g. \"1.0.0\".",
      "pattern": "^\\d+\\.\\d+\\.\\d+$"
    },

    "lastUpdated": {
      "type": "string",
      "description": "ISO 8601 timestamp of the last change to this file, e.g. \"2026-05-28T00:00:00Z\"."
    },

    "loci": {
      "type": "object",
      "description": "Map of locusId → LocusDefinition. Keys are snake_case locus identifiers.",
      "additionalProperties": { "$ref": "#/$defs/LocusDefinition" }
    },

    "combos": {
      "type": "array",
      "description": "Named market combos that require specific allele pairings across one or more loci.",
      "items": { "$ref": "#/$defs/ComboDefinition" }
    },

    "lethalCombos": {
      "type": "array",
      "description": "Genotypes that are embryonically lethal. The engine sets isLethal: true for any matching outcome.",
      "items": { "$ref": "#/$defs/LethalComboDefinition" }
    },

    "defectCombos": {
      "type": "array",
      "description": "Combination-triggered congenital (non-lethal) defects, e.g. Bug Eyes or Duckbilling. The engine adds the labels to congenitalWarnings for any matching outcome.",
      "items": { "$ref": "#/$defs/DefectComboDefinition" }
    },

    "epistasisRules": {
      "type": "array",
      "description": "Epistatic visual-masking overrides (e.g. BEL solid-white, Black Head Spider near-normal). When a rule's conditions all hold, the named visuals are suppressed and the rule's label is emitted instead. Only phenotypeNames is affected — genotype and congenital warnings are untouched.",
      "items": { "$ref": "#/$defs/EpistasisRule" }
    },

    "polygenicGroups": {
      "type": "array",
      "description": "Diagnostic-mode polygenic gates (e.g. Desert Ghost = dg_a/dg_b/dg_c). Used only when calculationMode is 'diagnostic'; the group is visual solely when its causalLocus is homozygous-mutant.",
      "items": { "$ref": "#/$defs/PolygenicGroup" }
    },

    "polygenicTags": {
      "type": "array",
      "description": "Valid polygenic trait labels (e.g. Jungle, Black Back). Free-form; the engine does not validate these against loci.",
      "items": { "type": "string" },
      "uniqueItems": true
    }
  },

  "$defs": {
    "InheritanceType": {
      "type": "string",
      "enum": ["recessive", "dominant", "incomplete_dominant", "polygenic"]
    },

    "AlleleDefinition": {
      "type": "object",
      "required": ["id", "name"],
      "additionalProperties": false,
      "properties": {
        "id": {
          "type": "string",
          "description": "Unique identifier within this locus, snake_case. Must match its parent map key.",
          "pattern": "^[a-z][a-z0-9_]*$"
        },
        "name": {
          "type": "string",
          "description": "Human-readable display name, e.g. \"Clown\" or \"Banana / Coral Glow\"."
        },
        "defects": {
          "type": "array",
          "description": "Congenital or neurological defect labels associated with this allele (even in the heterozygous state).",
          "items": { "type": "string" }
        },
        "superDefects": {
          "type": "array",
          "description": "Defect labels that fire only in the homozygous (super) state, e.g. Super Sable wobble.",
          "items": { "type": "string" }
        },
        "aliases": {
          "type": "array",
          "description": "Alternative names or abbreviations used in the community, e.g. [\"BP\", \"Blk Past\"].",
          "items": { "type": "string" }
        },
        "shortNames": {
          "type": "array",
          "description": "Very short labels for tub tags or printing shortcuts, e.g. [\"Past\"].",
          "items": { "type": "string" }
        },
        "indistinctFrom": {
          "type": "array",
          "description": "IDs of other alleles at THIS SAME locus that are visually indistinguishable from this one in the single-gene state.",
          "items": {
            "type": "string",
            "pattern": "^[a-z][a-z0-9_]*$"
          }
        }
      }
    },

    "LocusDefinition": {
      "type": "object",
      "required": ["id", "name", "inheritance", "isSexLinked", "alleles"],
      "additionalProperties": false,
      "properties": {
        "id": {
          "type": "string",
          "description": "Must match its parent map key.",
          "pattern": "^[a-z][a-z0-9_]*$"
        },
        "name": {
          "type": "string",
          "description": "Human-readable locus name, e.g. \"Yellowbelly Complex\"."
        },
        "inheritance": { "$ref": "#/$defs/InheritanceType" },
        "isSexLinked": {
          "type": "boolean",
          "description": "True for sex-linked loci (e.g. Banana / Coral Glow). The engine abandons independent assortment for these."
        },
        "supersededBy": {
          "type": "string",
          "description": "Marks a legacy duplicate of another locus. The locus stays valid (stored genotypes may reference its id), but name/alias lookups prefer the locus named here when both match.",
          "pattern": "^[a-z][a-z0-9_]*$"
        },
        "alleles": {
          "type": "object",
          "description": "Map of alleleId → AlleleDefinition. Must always include a \"normal\" allele.",
          "additionalProperties": { "$ref": "#/$defs/AlleleDefinition" }
        }
      }
    },

    "ComboDefinition": {
      "type": "object",
      "required": ["marketName", "requiredGenotype"],
      "additionalProperties": false,
      "properties": {
        "marketName": {
          "type": "string",
          "description": "The registered market name for this combination, e.g. \"Freeway\"."
        },
        "aliases": {
          "type": "array",
          "description": "Alternative names for this combo used in the community.",
          "items": { "type": "string" }
        },
        "shortNames": {
          "type": "array",
          "description": "Very short labels for tub tags or printing shortcuts.",
          "items": { "type": "string" }
        },
        "requiredGenotype": {
          "type": "object",
          "description": "Map of locusId → [alleleId, alleleId]. All listed locus conditions must match for the combo to trigger.",
          "additionalProperties": {
            "type": "array",
            "items": { "type": "string" },
            "minItems": 2,
            "maxItems": 2
          }
        }
      }
    },

    "LethalComboDefinition": {
      "type": "object",
      "required": ["triggerGenotype"],
      "additionalProperties": false,
      "properties": {
        "triggerGenotype": {
          "type": "object",
          "description": "Map of locusId → [alleleId, alleleId]. All listed locus conditions must match for lethality to be flagged.",
          "additionalProperties": {
            "type": "array",
            "items": { "type": "string" },
            "minItems": 2,
            "maxItems": 2
          }
        }
      }
    },

    "DefectComboDefinition": {
      "type": "object",
      "required": ["triggerGenotype", "defects"],
      "additionalProperties": false,
      "properties": {
        "triggerGenotype": {
          "type": "object",
          "description": "Map of locusId → [alleleId, alleleId]. All listed conditions must match for the defect to be flagged.",
          "additionalProperties": {
            "type": "array",
            "items": { "type": "string" },
            "minItems": 2,
            "maxItems": 2
          }
        },
        "defects": {
          "type": "array",
          "description": "Congenital defect labels to flag, e.g. [\"Bug Eyes\"].",
          "items": { "type": "string" }
        }
      }
    },

    "EpistasisLocusCondition": {
      "type": "object",
      "required": ["locusId", "state"],
      "additionalProperties": false,
      "properties": {
        "locusId": {
          "type": "string",
          "description": "The locus this condition tests.",
          "pattern": "^[a-z][a-z0-9_]*$"
        },
        "state": {
          "type": "string",
          "description": "'present' matches ≥1 copy of `allele` (or any mutant if omitted); 'homozygous' matches when both alleles are non-normal (super/compound).",
          "enum": ["present", "homozygous"]
        },
        "allele": {
          "type": "string",
          "description": "Optional specific allele the condition is restricted to.",
          "pattern": "^[a-z][a-z0-9_]*$"
        }
      }
    },

    "EpistasisRule": {
      "type": "object",
      "required": ["name", "conditions", "label"],
      "additionalProperties": false,
      "properties": {
        "name": {
          "type": "string",
          "description": "Rule label, e.g. \"Black Head Spider\"."
        },
        "conditions": {
          "type": "array",
          "description": "All conditions must hold for the rule to fire.",
          "items": { "$ref": "#/$defs/EpistasisLocusCondition" },
          "minItems": 1
        },
        "suppressLoci": {
          "type": "array",
          "description": "Loci whose visual names are removed when the rule fires. Defaults to the condition loci.",
          "items": { "type": "string", "pattern": "^[a-z][a-z0-9_]*$" }
        },
        "suppressAll": {
          "type": "boolean",
          "description": "When true, removes ALL visual names (a solid-white BEL masks everything)."
        },
        "label": {
          "type": "string",
          "description": "The phenotype emitted in place of the masked traits."
        }
      }
    },

    "PolygenicGroup": {
      "type": "object",
      "required": ["name", "loci", "causalLocus", "visualLabel"],
      "additionalProperties": false,
      "properties": {
        "name": {
          "type": "string",
          "description": "Group label, e.g. \"Desert Ghost\"."
        },
        "loci": {
          "type": "array",
          "description": "The diagnostic causal loci that make up the group, e.g. [\"dg_a\", \"dg_b\", \"dg_c\"].",
          "items": { "type": "string", "pattern": "^[a-z][a-z0-9_]*$" },
          "minItems": 1
        },
        "causalLocus": {
          "type": "string",
          "description": "The locus that gates the visual: the group is visual only when this locus is homozygous-mutant. Must appear in loci.",
          "pattern": "^[a-z][a-z0-9_]*$"
        },
        "visualLabel": {
          "type": "string",
          "description": "Phenotype emitted when the gate opens, e.g. \"Visual Desert Ghost\"."
        }
      }
    }
  }
}
