{
  "version": "4.1.0",
  "lastUpdated": "2026-10-23T01:38:14Z",
  "loci": {
    "pied_locus": {
      "id": "pied_locus",
      "name": "Piebald",
      "inheritance": "recessive",
      "isSexLinked": false,
      "alleles": {
        "normal": {
          "id": "normal",
          "name": "Normal"
        },
        "pied": {
          "id": "pied",
          "name": "Pied",
          "aliases": [
            "Piebald",
            "Pie Bald"
          ]
        }
      }
    },
    "axanthic_vpi_locus": {
      "id": "axanthic_vpi_locus",
      "name": "Axanthic (VPI Line)",
      "inheritance": "recessive",
      "isSexLinked": false,
      "supersededBy": "vpi_axanthic_locus",
      "alleles": {
        "normal": {
          "id": "normal",
          "name": "Normal"
        },
        "axanthic_vpi": {
          "id": "axanthic_vpi",
          "name": "Axanthic VPI"
        }
      }
    },
    "lavender_albino_locus": {
      "id": "lavender_albino_locus",
      "name": "Lavender Albino",
      "inheritance": "recessive",
      "isSexLinked": false,
      "alleles": {
        "normal": {
          "id": "normal",
          "name": "Normal"
        },
        "lavender_albino": {
          "id": "lavender_albino",
          "name": "Lavender Albino",
          "aliases": [
            "Lavender",
            "Lav Albino"
          ]
        }
      }
    },
    "genetic_stripe_locus": {
      "id": "genetic_stripe_locus",
      "name": "Genetic Stripe",
      "inheritance": "recessive",
      "isSexLinked": false,
      "supersededBy": "g_stripe_locus",
      "alleles": {
        "normal": {
          "id": "normal",
          "name": "Normal"
        },
        "genetic_stripe": {
          "id": "genetic_stripe",
          "name": "Genetic Stripe"
        }
      }
    },
    "pastel_locus": {
      "id": "pastel_locus",
      "name": "Pastel",
      "inheritance": "incomplete_dominant",
      "isSexLinked": false,
      "alleles": {
        "normal": {
          "id": "normal",
          "name": "Normal"
        },
        "pastel": {
          "id": "pastel",
          "name": "Pastel",
          "aliases": [
            "Lemon Pastel",
            "Citrus Pastel"
          ]
        }
      }
    },
    "ghi_locus": {
      "id": "ghi_locus",
      "name": "GHI",
      "inheritance": "incomplete_dominant",
      "isSexLinked": false,
      "alleles": {
        "normal": {
          "id": "normal",
          "name": "Normal"
        },
        "ghi": {
          "id": "ghi",
          "name": "GHI"
        }
      }
    },
    "spider_complex": {
      "id": "spider_complex",
      "name": "Spider",
      "inheritance": "dominant",
      "isSexLinked": false,
      "alleles": {
        "normal": {
          "id": "normal",
          "name": "Normal"
        },
        "spider": {
          "id": "spider",
          "name": "Spider",
          "defects": [
            "Neurological Wobble"
          ]
        },
        "bongo": {
          "id": "bongo",
          "name": "Bongo",
          "shortNames": [
            "Bongo"
          ]
        },
        "champagne": {
          "id": "champagne",
          "name": "Champagne",
          "shortNames": [
            "Champ"
          ],
          "defects": [
            "Neurological Wobble"
          ]
        },
        "chocolate": {
          "id": "chocolate",
          "name": "Chocolate",
          "shortNames": [
            "Choc"
          ],
          "indistinctFrom": [
            "wookie"
          ]
        },
        "chocolate_garcia": {
          "id": "chocolate_garcia",
          "name": "Chocolate - Garcia",
          "aliases": [
            "Garcia"
          ],
          "shortNames": [
            "Choc-Garc"
          ]
        },
        "cypress": {
          "id": "cypress",
          "name": "Cypress",
          "shortNames": [
            "Cyp"
          ]
        },
        "hidden_gene_woma": {
          "id": "hidden_gene_woma",
          "name": "Hidden Gene Woma",
          "aliases": [
            "HGW"
          ],
          "shortNames": [
            "HGW"
          ],
          "indistinctFrom": [
            "woma"
          ],
          "defects": [
            "Neurological Wobble"
          ]
        },
        "sable": {
          "id": "sable",
          "name": "Sable",
          "shortNames": [
            "Sable"
          ],
          "superDefects": [
            "Neurological Wobble"
          ]
        },
        "spotnose": {
          "id": "spotnose",
          "name": "Spotnose",
          "aliases": [
            "Spotnose",
            "SN"
          ],
          "shortNames": [
            "SN",
            "PBall"
          ],
          "superDefects": [
            "Neurological Wobble"
          ]
        },
        "woma": {
          "id": "woma",
          "name": "Woma",
          "shortNames": [
            "Woma"
          ],
          "indistinctFrom": [
            "hidden_gene_woma"
          ],
          "defects": [
            "Neurological Wobble"
          ]
        },
        "wookie": {
          "id": "wookie",
          "name": "Wookie",
          "shortNames": [
            "Wook"
          ],
          "indistinctFrom": [
            "chocolate"
          ]
        }
      }
    },
    "cinnamon_complex": {
      "id": "cinnamon_complex",
      "name": "Cinnamon Complex",
      "inheritance": "incomplete_dominant",
      "isSexLinked": false,
      "alleles": {
        "normal": {
          "id": "normal",
          "name": "Normal"
        },
        "cinnamon": {
          "id": "cinnamon",
          "name": "Cinnamon",
          "aliases": [
            "Cinny"
          ]
        },
        "black_pastel": {
          "id": "black_pastel",
          "name": "Black Pastel",
          "aliases": [
            "Barnhart Black Pastel"
          ]
        },
        "enchi": {
          "id": "enchi",
          "name": "Enchi"
        },
        "het_red_axanthic": {
          "id": "het_red_axanthic",
          "name": "Het Red Axanthic",
          "aliases": [
            "Het Red"
          ]
        },
        "huffman": {
          "id": "huffman",
          "name": "Huffman"
        },
        "jolt": {
          "id": "jolt",
          "name": "Jolt"
        },
        "razor": {
          "id": "razor",
          "name": "Razor"
        },
        "lace_black_back": {
          "id": "lace_black_back",
          "name": "Lace Black Back",
          "aliases": [
            "Green Pastel",
            "Exo-LBB"
          ],
          "shortNames": [
            "LaceBB"
          ]
        },
        "lori": {
          "id": "lori",
          "name": "Lori"
        }
      }
    },
    "yellowbelly_complex": {
      "id": "yellowbelly_complex",
      "name": "Yellowbelly Complex",
      "inheritance": "incomplete_dominant",
      "isSexLinked": false,
      "alleles": {
        "normal": {
          "id": "normal",
          "name": "Normal"
        },
        "yellowbelly": {
          "id": "yellowbelly",
          "name": "Yellowbelly",
          "indistinctFrom": [
            "asphalt",
            "gravel"
          ],
          "aliases": [
            "Flare",
            "Yellow Belly"
          ]
        },
        "asphalt": {
          "id": "asphalt",
          "name": "Asphalt",
          "aliases": [
            "RK Asphalt"
          ],
          "indistinctFrom": [
            "yellowbelly",
            "gravel"
          ]
        },
        "gravel": {
          "id": "gravel",
          "name": "Gravel",
          "shortNames": [
            "Grav"
          ],
          "indistinctFrom": [
            "yellowbelly",
            "asphalt"
          ]
        },
        "spark": {
          "id": "spark",
          "name": "Spark",
          "shortNames": [
            "Spark"
          ]
        },
        "specter": {
          "id": "specter",
          "name": "Specter",
          "shortNames": [
            "Specter"
          ]
        },
        "orange_belly": {
          "id": "orange_belly",
          "name": "Orange Belly"
        },
        "goblin": {
          "id": "goblin",
          "name": "Goblin"
        },
        "bling_yellow_belly": {
          "id": "bling_yellow_belly",
          "name": "Bling Yellow Belly"
        }
      }
    },
    "black_head_complex": {
      "id": "black_head_complex",
      "name": "Black Head",
      "inheritance": "incomplete_dominant",
      "isSexLinked": false,
      "alleles": {
        "normal": {
          "id": "normal",
          "name": "Normal"
        },
        "black_head": {
          "id": "black_head",
          "name": "Black Head"
        }
      }
    },
    "banana_locus": {
      "id": "banana_locus",
      "name": "Banana / Coral Glow",
      "inheritance": "incomplete_dominant",
      "isSexLinked": true,
      "alleles": {
        "normal": {
          "id": "normal",
          "name": "Normal"
        },
        "banana": {
          "id": "banana",
          "name": "Banana / Coral Glow",
          "aliases": [
            "Coral Glow",
            "Cg"
          ]
        },
        "whitesmoke": {
          "id": "whitesmoke",
          "name": "Whitesmoke"
        }
      }
    },
    "acid_locus": {
      "id": "acid_locus",
      "name": "Acid",
      "inheritance": "incomplete_dominant",
      "isSexLinked": false,
      "alleles": {
        "normal": {
          "id": "normal",
          "name": "Normal"
        },
        "acid": {
          "id": "acid",
          "name": "Acid",
          "shortNames": [
            "Acid"
          ],
          "aliases": [
            "Static"
          ]
        },
        "confusion": {
          "id": "confusion",
          "name": "Confusion",
          "shortNames": [
            "Conf"
          ]
        }
      }
    },
    "ajax_locus": {
      "id": "ajax_locus",
      "name": "Ajax",